{
  "schema_version": "2.0.0",
  "report_type": "projection_log",
  "target_rq_url": "https://app.notion.com/p/3e3e5855be3981129c7fd1ff68a9098b",
  "rq_id": "RQ-0018",
  "source_investigation_id": "INV-000013",
  "source_30_analysis_commit_sha": "b7c93c1c4786a288d273bccc314d3b772a0b1f86",
  "projection_timestamp": "2026-09-23T01:12:20+09:00",
  "projection_target": {
    "surface": "page_body",
    "section_heading": "# Working Answer"
  },
  "result": "SUCCESS",
  "note": "BKL-0025 migration/E2E. Generated the structured current view from accepted INV-000013 30_analysis, projected only the RQ body # Working Answer section, refetched Notion and verified exact deterministic match. Legacy Working Answer property was preserved without dual-write; RQ Status remained Active."
}
