{
  "schema_version": "2.0.0",
  "report_type": "projection_log",
  "target_rq_url": "https://app.notion.com/p/3e5e5855be398180bb66f371eda89979",
  "rq_id": "RQ-000027",
  "source_investigation_id": "INV-000027",
  "source_30_analysis_commit_sha": "2c9bf506e8ffe80dc0fcf06fc5d71b69b3ee9760",
  "projection_timestamp": "2026-09-24T16:06:15.355Z",
  "projection_target": {
    "surface": "page_body",
    "section_heading": "# Working Answer"
  },
  "result": "SUCCESS",
  "note": "Human accepted current analysis; deterministic body projection verified CURRENT."
}
