{
  "schema_version": "2.0.0",
  "report_type": "projection_log",
  "target_rq_url": "https://app.notion.com/p/3e9e5855be39815080e2d5313f459d73",
  "rq_id": "RQ-000030",
  "source_investigation_id": "INV-000030",
  "source_30_analysis_commit_sha": "ae364909b1d72027bcce1d4be388c0a4df4c6e62",
  "projection_timestamp": "2026-09-28T09:37:32.491Z",
  "projection_target": {
    "surface": "page_body",
    "section_heading": "# Working Answer"
  },
  "result": "SUCCESS",
  "note": "Accepted after Review 000002 PASS; deterministic Working Answer body projection verified CURRENT."
}
