{
  "schema_version": "2.0.0",
  "report_type": "projection_log",
  "target_rq_url": "https://app.notion.com/p/3e5e5855be3981f284b4dba4f6fd10ef",
  "rq_id": "RQ-000025",
  "source_investigation_id": "INV-000025",
  "source_30_analysis_commit_sha": "7ac502456f82dcaac0c556ca19d042bad4e5a572",
  "projection_timestamp": "2026-09-24T15:41:09.484Z",
  "projection_target": {
    "surface": "page_body",
    "section_heading": "# Working Answer"
  },
  "result": "SUCCESS",
  "note": "Accepted current analysis and verified deterministic projection."
}
